incident_type,description,sub_description,,1,Fire,Fire,,10,"Fire, other",Fire,,100,"Fire, other",Fire,,11,Structure Fire,Structure fire,,110,"Structure fire, other (conversion only)",Fire,,111,Building fire,Structure fire,,112,Fires in structure other than in a building,Fire,,113,"Cooking fire, confined to container",Fire,,114,"Chimney or flue fire, confined to chimney or flue",Fire,,115,"Incinerator overload or malfunction, fire confined",Fire,,116,"Fuel burner/boiler malfunction, fire confined",Fire,,117,"Commercial Compactor fire, confined to rubbish",Fire,,118,"Trash or rubbish fire, contained",Fire,,12,Fire in mobile property used as a fixed structure,Fire,,120,"Fire in mobile prop. used as a fixed struc., other",Fire,,121,Fire in mobile home used as fixed residence,Fire,,122,"Fire in motor home, camper, recreational vehicle",Fire,,123,"Fire in portable building, fixed location",Fire,,13,Mobile property (vehicle) fire,Vehicle Fire,,130,"Mobile property (vehicle) fire, other",Vehicle Fire,,131,Passenger vehicle fire,Vehicle Fire,,132,Road freight or transport vehicle fire,Vehicle Fire,,133,Rail vehicle fire,Rail vehicle fire,,134,Water vehicle fire,Fire,,135,Aircraft fire,Fire,,136,Self-propelled motor home or recreational vehicle,Fire,,137,Camper or recreational vehicle (RV) fire,Vehicle Fire,,138,Off-road vehicle or heavy equipment fire,Vehicle Fire,,14,Natural vegetation fire,Field fire,,140,"Natural vegetation fire, other",Field fire,,141,"Forest, woods or wildland fire",Field fire,,142,Brush or brush-and-grass mixture fire,Field fire,,143,Grass fire,Field fire,,15,Outside rubbish fire,Fire,,150,"Outside rubbish fire, other",Fire,,151,"Outside rubbish, trash or waste fire",Fire,,152,Garbage dump or sanitary landfill fire,Fire,,153,Construction or demolition landfill fire,Fire,,154,Dumpster or other outside trash receptacle fire,Fire,,155,Outside stationary compactor/compacted trash fire,Fire,,16,Special outside fire,Fire,,160,"Special outside fire, other",Fire,,161,Outside storage fire,Fire,,162,Outside equipment fire,Fire,,163,Outside gas or vapor combustion explosion,Fire,,164,Outside mailbox fire,Fire,,17,"Cultivated vegetation, crop fire",Fire,,170,"Cultivated vegetation, crop fire, other",Fire,,171,Cultivated grain or crop fire,Fire,,172,Cultivated orchard or vineyard fire,Fire,,173,Cultivated trees or nursery stock fire,Fire,,2,"Overpressure Rupture, Explosion, Overheat(no fire)",Fire,,20,"Overpressure rupture, explosion, overheat, other",Fire,,200,"Overpressure rupture, explosion, overheat other",Fire,,21,Overpressure rupture from steam (no ensuing fire),Fire,,210,"Overpressure rupture from steam, other",Fire,,211,Overpressure rupture of steam pipe or pipeline,Fire,,212,Overpressure rupture of steam boiler,Fire,,213,Steam rupture of pressure or process vessel,Fire,,22,Overpressure rupture from air or gas (no fire),Fire,,220,"Overpressure rupture from air or gas, other",Fire,,221,Overpressure rupture of air or gas pipe/pipeline,Fire,,222,Overpressure rupture of boiler from air or gas,Fire,,223,Air or gas rupture of pressure or process vessel,Fire,,23,"Overpressure rupture, chemical reaction (no fire)",Fire,,231,Chemical reaction rupture of process vessel,Fire,,24,Explosion (no fire),Fire,,240,"Explosion (no fire), other",Fire,,241,Munitions or bomb explosion (no fire),Fire,,242,Blasting agent explosion (no fire),Fire,,243,Fireworks explosion (no fire),Fire,,244,Dust explosion (no fire),Fire,,25,"Excessive heat, scorch burns with no ignition",Fire,,251,"Excessive heat, scorch burns with no ignition",Fire,,3,Rescue & Emergency Medical Service Incident,Rescue,,30,"Rescue, emergency medical call (EMS), other",Rescue,,300,"Rescue, EMS incident, other",Rescue,,31,Medical assist,EMS,,311,"Medical assist, assist EMS crew",EMS,,32,Emergency medical service (EMS) incident,EMS,,320,"Emergency medical service incident, other",EMS,,321,"EMS call, excluding vehicle accident with injury",MVA,,322,Motor vehicle accident with injuries,MVA,,323,Motor vehicle/pedestrian accident (MV Ped),MVA,,324,Motor vehicle accident with no injuries.,MVA,,33,Lock-In,Other,,331,"Lock-in (if lock out , use 511 )",Other,,34,Search for lost person,Other,,340,"Search for lost person, other",Other,,341,Search for person on land,Other,,342,Search for person in water,Other,,343,Search for person underground,Other,,35,"Extrication, rescue",Rescue,,350,"Extrication, rescue, other",Rescue,,351,Extrication of victim(s) from building/structure,Rescue,,352,Extrication of victim(s) from vehicle,Rescue,,353,Removal of victim(s) from stalled elevator,Rescue,,354,Trench/below-grade rescue,Rescue,,355,Confined space rescue,Rescue,,356,High-angle rescue,Rescue,,357,Extrication of victim(s) from machinery,Rescue,,36,Water or ice-related rescue,Rescue,,360,"Water & ice-related rescue, other",Rescue,,361,Swimming/recreational water areas rescue,Rescue,,362,Ice rescue,Rescue,,363,Swift water rescue,Rescue,,364,Surf rescue,Rescue,,365,Watercraft rescue,Rescue,,37,Electrical rescue,Rescue,,370,"Electrical rescue, other",Rescue,,371,Electrocution or potential electrocution,Rescue,,372,Trapped by power lines,Rescue,,38,Rescue or EMS standby,Rescue,,381,Rescue or EMS standby,Rescue,,4,Hazardous Condition (No Fire),Haz Mat,,40,"Flammable gas or liquid condition, other",Haz Mat,,400,"Hazardous condition, other",Haz Mat,,41,Combustible/flammable spills & leaks,Haz Mat,,410,"Combustible/flammable gas/liquid condition, other",Haz Mat,,411,Gasoline or other flammable liquid spill,Haz Mat,,412,Gas leak (natural gas or LPG),Haz Mat,,413,Oil or other combustible liquid spill,Haz Mat,,42,"Chemical release, reaction, or toxic condition",Haz Mat,,420,"Toxic condition, other",Haz Mat,,421,Chemical hazard (no spill or leak),Haz Mat,,422,Chemical spill or leak,Haz Mat,,423,Refrigeration leak,Haz Mat,,424,Carbon monoxide incident,Haz Mat,,43,Radioactive condition,Haz Mat,,430,"Radioactive condition, other",Haz Mat,,431,"Radiation leak, radioactive material",Haz Mat,,44,Electrical wiring/equipment problem,Fire,,440,"Electrical  wiring/equipment problem, other",Fire,,441,"Heat from short circuit (wiring), defective/worn",Fire,,442,Overheated motor,Fire,,443,Breakdown of light ballast,Fire,,444,Power line down,Fire,,445,"Arcing, shorted electrical equipment",Fire,,45,Biological hazard,Haz Mat,,451,"Biological hazard, confirmed or suspected",Haz Mat,,46,"Accident, potential accident",Other,,460,"Accident, potential accident, other",Other,,461,Building or structure weakened or collapsed,Rescue,,462,Aircraft standby,Other,,463,"Vehicle accident, general cleanup",MVA,,47,"Explosive, bomb removal",Haz Mat,,471,"Explosive, bomb removal (for bomb scare, use 721)",Haz Mat,,48,"Attempted burning, illegal action",Illeagal burn,,480,"Attempted burning, illegal action, other",Illeagal burn,,481,Attempt to burn,Illeagal burn,,482,Threat to burn,Illeagal burn,,5,Service Call,Other,,50,"Service call, other",Other,,500,"Service Call, other",Other,,51,Person in distress,Other,,510,"Person in distress, other",Other,,511,Lock-out,Other,,512,Ring or jewelry removal,Other,,52,Water problem,Other,,520,"Water problem, other",Other,,521,Water evacuation,Other,,522,Water or steam leak,Other,,53,"Smoke, odor problem",Fire,,531,Smoke or odor removal,Fire,,54,Animal problem or rescue,Animal problem or rescue,,540,"Animal problem, other",Animal problem or rescue,,541,Animal problem,Animal problem or rescue,,542,Animal rescue,Animal problem or rescue,,55,Public service assistance,Other,,550,"Public service assistance, other",Other,,551,Assist police or other governmental agency,Assist police or other governmental agency,,552,Police matter,Assist police or other governmental agency,,553,Public service,Other,,554,Assist invalid,Other,,555,"Defective elevator, no occupants",Other,,56,Unauthorized burning,Illeagal burn,,561,Unauthorized burning,Illeagal burn,,57,"Cover assignment, standby at fire station, move-up",Fire,,571,"Cover assignment, standby, moveup",Fire,,6,Good Intent Call,Other,,60,"Good intent call, other",Other,,600,"Good intent call, other",Other,,61,Dispatched and canceled en route,Cancel,,611,Dispatched & canceled en route,Cancel,,62,"Wrong location, no emergency found",Cancel,,621,Wrong location,Cancel,,622,No incident found on arrival at dispatch address,Cancel,,63,Controlled burning,Other,,631,Authorized controlled burning,Other,,632,Prescribed fire,Other,,64,Vicinity alarm,Fire,,641,Vicinity alarm (incident in other location),Fire,,65,"Steam, other gas mistaken for smoke",Fire,,650,"Steam, other gas mistaken for smoke, other",Fire,,651,"Smoke scare, odor of smoke",Fire,,652,"Steam, vapor, fog or dust thought to be smoke",Fire,,653,"Smoke from barbecue, tar kettle",Fire,,66,EMS call where  party has been transported,EMS,,661,"EMS call, party transported by non-fire agency",EMS,,67,HazMat release investigation w/no HazMat,Haz Mat,,671,HazMat release investigation w/no HazMat,Haz Mat,,672,"Biological hazard investigation, none found",Haz Mat,,7,False Alarm & False Call,Fire,,70,"False alarm and false call, other",Fire,,700,"False alarm or false call, other",Fire,,71,"Malicious, mischievous false alarm",Fire,,710,"Malicious, mischievous false call, other",Fire,,711,"Municipal alarm system, malicious false alarm",Fire,,712,"Direct tie to FD, malicious false alarm",Fire,,713,"Telephone, malicious false alarm",Fire,,714,"Central station, malicious false alarm",Fire,,715,"Local alarm system, malicious false alarm",Fire,,72,Bomb scare,Fire,,721,Bomb scare - no bomb,Fire,,73,System or detector malfunction,Fire,,730,"System malfunction, other",Fire,,731,Sprinkler activation due to malfunction,Fire,,732,Extinguishing system activation due to malfunction,Fire,,733,Smoke detector activation due to malfunction,Fire,,734,Heat detector activation due to malfunction,Fire,,735,Alarm system sounded due to malfunction,Fire,,736,CO detector activation due to malfunction,Fire,,74,Unintentional system/detector operation (no fire),Fire,,740,"Unintentional transmission of alarm, other",Fire,,741,"Sprinkler activation, no fire - unintentional",Fire,,742,Extinguishing system activation,Fire,,743,"Smoke detector activation, no fire - unintentional",Fire,,744,"Detector activation, no fire - unintentional",Fire,,745,"Alarm system activation, no fire - unintentional",Fire,,746,"Carbon monoxide detector activation, no CO",Fire,,75,Biohazard scare,Haz Mat,,751,"Biological hazard, malicious false report",Haz Mat,,8,Severe Weather & Natural Disaster,Severe Weather & Natural Disaster,,800,"Severe weather or natural disaster, other",Severe Weather & Natural Disaster,,811,Earthquake assessment,Severe Weather & Natural Disaster,,812,Flood assessment,Severe Weather & Natural Disaster,,813,"Wind storm, tornado/hurricane assessment",Severe Weather & Natural Disaster,,814,Lightning strike (no fire),Severe Weather & Natural Disaster,,815,Severe weather or natural disaster standby,Severe Weather & Natural Disaster,,9,Special Incident Type,Other,,90,"Special type of incident, other",Other,,900,"Special type of incident, other",Other,,91,Citizen complaint,Other,,911,Citizen complaint,Other,,UUU,Undetermined incident type (conversion only),Other,,